[INFO] Scanning for projects...
[INFO] 
[INFO] ---------------------------< com.bank:demo >----------------------------
[INFO] Building banking-api 0.0.1-SNAPSHOT
[INFO]   from pom.xml
[INFO] --------------------------------[ jar ]---------------------------------
[INFO] 
[INFO] --- resources:3.3.1:resources (default-resources) @ demo ---
[INFO] Copying 1 resource from src/main/resources to target/classes
[INFO] Copying 0 resource from src/main/resources to target/classes
[INFO] 
[INFO] --- compiler:3.11.0:compile (default-compile) @ demo ---
[INFO] Changes detected - recompiling the module! :source
[INFO] Compiling 35 source files with javac [debug release 17] to target/classes
[INFO] 
[INFO] --- resources:3.3.1:testResources (default-testResources) @ demo ---
[INFO] skip non existing resourceDirectory /home/cactus1549/Banking_webApp/banking-api/demo/src/test/resources
[INFO] 
[INFO] --- compiler:3.11.0:testCompile (default-testCompile) @ demo ---
[INFO] Changes detected - recompiling the module! :dependency
[INFO] Compiling 1 source file with javac [debug release 17] to target/test-classes
[INFO] 
[INFO] --- surefire:3.5.3:test (default-test) @ demo ---
[INFO] Using auto detected provider org.apache.maven.surefire.junitplatform.JUnitPlatformProvider
[INFO] 
[INFO] -------------------------------------------------------
[INFO]  T E S T S
[INFO] -------------------------------------------------------
[INFO] Running com.bank.demo.BankingApiApplicationTests
01:31:33.171 [main] INFO org.springframework.test.context.support.AnnotationConfigContextLoaderUtils -- Could not detect default configuration classes for test class [com.bank.demo.BankingApiApplicationTests]: BankingApiApplicationTests does not declare any static, non-private, non-final, nested classes annotated with @Configuration.
01:31:33.252 [main] INFO org.springframework.boot.test.context.SpringBootTestContextBootstrapper -- Found @SpringBootConfiguration com.bank.demo.BankingApiApplication for test class com.bank.demo.BankingApiApplicationTests

  .   ____          _            __ _ _
 /\\ / ___'_ __ _ _(_)_ __  __ _ \ \ \ \
( ( )\___ | '_ | '_| | '_ \/ _` | \ \ \ \
 \\/  ___)| |_)| | | | | || (_| |  ) ) ) )
  '  |____| .__|_| |_|_| |_\__, | / / / /
 =========|_|==============|___/=/_/_/_/

 :: Spring Boot ::                (v3.5.3)

2025-08-08T01:31:33.558-04:00  INFO 14056 --- [banking-api] [           main] c.bank.demo.BankingApiApplicationTests   : Starting BankingApiApplicationTests using Java 17.0.15 with PID 14056 (started by cactus1549 in /home/cactus1549/Banking_webApp/banking-api/demo)
2025-08-08T01:31:33.559-04:00  INFO 14056 --- [banking-api] [           main] c.bank.demo.BankingApiApplicationTests   : No active profile set, falling back to 1 default profile: "default"
2025-08-08T01:31:34.007-04:00  INFO 14056 --- [banking-api] [           main] .s.d.r.c.RepositoryConfigurationDelegate : Bootstrapping Spring Data JPA repositories in DEFAULT mode.
2025-08-08T01:31:34.054-04:00  INFO 14056 --- [banking-api] [           main] .s.d.r.c.RepositoryConfigurationDelegate : Finished Spring Data repository scanning in 40 ms. Found 3 JPA repository interfaces.
2025-08-08T01:31:34.441-04:00  INFO 14056 --- [banking-api] [           main] o.hibernate.jpa.internal.util.LogHelper  : HHH000204: Processing PersistenceUnitInfo [name: default]
2025-08-08T01:31:34.473-04:00  INFO 14056 --- [banking-api] [           main] org.hibernate.Version                    : HHH000412: Hibernate ORM core version 6.6.18.Final
2025-08-08T01:31:34.495-04:00  INFO 14056 --- [banking-api] [           main] o.h.c.internal.RegionFactoryInitiator    : HHH000026: Second-level cache disabled
2025-08-08T01:31:34.564-04:00  INFO 14056 --- [banking-api] [           main] com.zaxxer.hikari.HikariDataSource       : HikariPool-1 - Starting...
2025-08-08T01:31:34.704-04:00  INFO 14056 --- [banking-api] [           main] com.zaxxer.hikari.pool.HikariPool        : HikariPool-1 - Added connection org.postgresql.jdbc.PgConnection@161d95c6
2025-08-08T01:31:34.705-04:00  INFO 14056 --- [banking-api] [           main] com.zaxxer.hikari.HikariDataSource       : HikariPool-1 - Start completed.
2025-08-08T01:31:34.726-04:00  WARN 14056 --- [banking-api] [           main] org.hibernate.orm.deprecation            : HHH90000025: PostgreSQLDialect does not need to be specified explicitly using 'hibernate.dialect' (remove the property setting and it will be selected by default)
2025-08-08T01:31:34.740-04:00  INFO 14056 --- [banking-api] [           main] org.hibernate.orm.connections.pooling    : HHH10001005: Database info:
	Database JDBC URL [Connecting through datasource 'HikariDataSource (HikariPool-1)']
	Database driver: undefined/unknown
	Database version: 17.5
	Autocommit mode: undefined/unknown
	Isolation level: undefined/unknown
	Minimum pool size: undefined/unknown
	Maximum pool size: undefined/unknown
2025-08-08T01:31:34.891-04:00  INFO 14056 --- [banking-api] [           main] o.s.o.j.p.SpringPersistenceUnitInfo      : No LoadTimeWeaver setup: ignoring JPA class transformer
2025-08-08T01:31:35.552-04:00  INFO 14056 --- [banking-api] [           main] o.h.e.t.j.p.i.JtaPlatformInitiator       : HHH000489: No JTA platform available (set 'hibernate.transaction.jta.platform' to enable JTA platform integration)
2025-08-08T01:31:35.554-04:00  INFO 14056 --- [banking-api] [           main] j.LocalContainerEntityManagerFactoryBean : Initialized JPA EntityManagerFactory for persistence unit 'default'
2025-08-08T01:31:35.704-04:00  INFO 14056 --- [banking-api] [           main] o.s.d.j.r.query.QueryEnhancerFactory     : Hibernate is in classpath; If applicable, HQL parser will be used.
--> Initializing UserDetailsService bean.
2025-08-08T01:31:36.017-04:00  WARN 14056 --- [banking-api] [           main] JpaBaseConfiguration$JpaWebConfiguration : spring.jpa.open-in-view is enabled by default. Therefore, database queries may be performed during view rendering. Explicitly configure spring.jpa.open-in-view to disable this warning
--> JwtAuthenticationFilter Initiliazation.
Hibernate: select u1_0.user_id,u1_0.address,u1_0.created_at,u1_0.date_of_birth,u1_0.email,u1_0.email_verified,u1_0.failed_login_attempts,u1_0.first_name,u1_0.is_active,u1_0.last_login_at,u1_0.last_name,u1_0.password_hash,u1_0.phone,u1_0.role,u1_0.ssn_hash,u1_0.updated_at,u1_0.username from users u1_0
Hibernate: select u1_0.user_id,u1_0.address,u1_0.created_at,u1_0.date_of_birth,u1_0.email,u1_0.email_verified,u1_0.failed_login_attempts,u1_0.first_name,u1_0.is_active,u1_0.last_login_at,u1_0.last_name,u1_0.password_hash,u1_0.phone,u1_0.role,u1_0.ssn_hash,u1_0.updated_at,u1_0.username from users u1_0 where u1_0.user_id=?
Hibernate: update users set address=?,created_at=?,date_of_birth=?,email=?,email_verified=?,failed_login_attempts=?,first_name=?,is_active=?,last_login_at=?,last_name=?,password_hash=?,phone=?,role=?,ssn_hash=?,updated_at=?,username=? where user_id=?
2025-08-08T01:31:36.314-04:00  WARN 14056 --- [banking-api] [           main] o.h.engine.jdbc.spi.SqlExceptionHelper   : SQL Error: 0, SQLState: 42804
2025-08-08T01:31:36.314-04:00 ERROR 14056 --- [banking-api] [           main] o.h.engine.jdbc.spi.SqlExceptionHelper   : ERROR: column "role" is of type user_role but expression is of type character varying
  Hint: You will need to rewrite or cast the expression.
  Position: 203
2025-08-08T01:31:36.320-04:00  WARN 14056 --- [banking-api] [           main] o.s.w.c.s.GenericWebApplicationContext   : Exception encountered during context initialization - cancelling refresh attempt: org.springframework.beans.factory.BeanCreationException: Error creating bean with name 'passwordMigrationService': Invocation of init method failed
2025-08-08T01:31:36.320-04:00  INFO 14056 --- [banking-api] [           main] j.LocalContainerEntityManagerFactoryBean : Closing JPA EntityManagerFactory for persistence unit 'default'
2025-08-08T01:31:36.322-04:00  INFO 14056 --- [banking-api] [           main] com.zaxxer.hikari.HikariDataSource       : HikariPool-1 - Shutdown initiated...
2025-08-08T01:31:36.331-04:00  INFO 14056 --- [banking-api] [           main] com.zaxxer.hikari.HikariDataSource       : HikariPool-1 - Shutdown completed.
2025-08-08T01:31:36.353-04:00  INFO 14056 --- [banking-api] [           main] .s.b.a.l.ConditionEvaluationReportLogger : 

Error starting ApplicationContext. To display the condition evaluation report re-run your application with 'debug' enabled.
2025-08-08T01:31:36.366-04:00 ERROR 14056 --- [banking-api] [           main] o.s.boot.SpringApplication               : Application run failed

org.springframework.beans.factory.BeanCreationException: Error creating bean with name 'passwordMigrationService': Invocation of init method failed
	at org.springframework.beans.factory.annotation.InitDestroyAnnotationBeanPostProcessor.postProcessBeforeInitialization(InitDestroyAnnotationBeanPostProcessor.java:222) ~[spring-beans-6.2.8.jar:6.2.8]
	at org.springframework.beans.factory.support.AbstractAutowireCapableBeanFactory.applyBeanPostProcessorsBeforeInitialization(AbstractAutowireCapableBeanFactory.java:429) ~[spring-beans-6.2.8.jar:6.2.8]
	at org.springframework.beans.factory.support.AbstractAutowireCapableBeanFactory.initializeBean(AbstractAutowireCapableBeanFactory.java:1818) ~[spring-beans-6.2.8.jar:6.2.8]
	at org.springframework.beans.factory.support.AbstractAutowireCapableBeanFactory.doCreateBean(AbstractAutowireCapableBeanFactory.java:607) ~[spring-beans-6.2.8.jar:6.2.8]
	at org.springframework.beans.factory.support.AbstractAutowireCapableBeanFactory.createBean(AbstractAutowireCapableBeanFactory.java:529) ~[spring-beans-6.2.8.jar:6.2.8]
	at org.springframework.beans.factory.support.AbstractBeanFactory.lambda$doGetBean$0(AbstractBeanFactory.java:339) ~[spring-beans-6.2.8.jar:6.2.8]
	at org.springframework.beans.factory.support.DefaultSingletonBeanRegistry.getSingleton(DefaultSingletonBeanRegistry.java:373) ~[spring-beans-6.2.8.jar:6.2.8]
	at org.springframework.beans.factory.support.AbstractBeanFactory.doGetBean(AbstractBeanFactory.java:337) ~[spring-beans-6.2.8.jar:6.2.8]
	at org.springframework.beans.factory.support.AbstractBeanFactory.getBean(AbstractBeanFactory.java:202) ~[spring-beans-6.2.8.jar:6.2.8]
	at org.springframework.beans.factory.support.DefaultListableBeanFactory.instantiateSingleton(DefaultListableBeanFactory.java:1222) ~[spring-beans-6.2.8.jar:6.2.8]
	at org.springframework.beans.factory.support.DefaultListableBeanFactory.preInstantiateSingleton(DefaultListableBeanFactory.java:1188) ~[spring-beans-6.2.8.jar:6.2.8]
	at org.springframework.beans.factory.support.DefaultListableBeanFactory.preInstantiateSingletons(DefaultListableBeanFactory.java:1123) ~[spring-beans-6.2.8.jar:6.2.8]
	at org.springframework.context.support.AbstractApplicationContext.finishBeanFactoryInitialization(AbstractApplicationContext.java:987) ~[spring-context-6.2.8.jar:6.2.8]
	at org.springframework.context.support.AbstractApplicationContext.refresh(AbstractApplicationContext.java:627) ~[spring-context-6.2.8.jar:6.2.8]
	at org.springframework.boot.SpringApplication.refresh(SpringApplication.java:752) ~[spring-boot-3.5.3.jar:3.5.3]
	at org.springframework.boot.SpringApplication.refreshContext(SpringApplication.java:439) ~[spring-boot-3.5.3.jar:3.5.3]
	at org.springframework.boot.SpringApplication.run(SpringApplication.java:318) ~[spring-boot-3.5.3.jar:3.5.3]
	at org.springframework.boot.test.context.SpringBootContextLoader.lambda$loadContext$3(SpringBootContextLoader.java:144) ~[spring-boot-test-3.5.3.jar:3.5.3]
	at org.springframework.util.function.ThrowingSupplier.get(ThrowingSupplier.java:58) ~[spring-core-6.2.8.jar:6.2.8]
	at org.springframework.util.function.ThrowingSupplier.get(ThrowingSupplier.java:46) ~[spring-core-6.2.8.jar:6.2.8]
	at org.springframework.boot.SpringApplication.withHook(SpringApplication.java:1461) ~[spring-boot-3.5.3.jar:3.5.3]
	at org.springframework.boot.test.context.SpringBootContextLoader$ContextLoaderHook.run(SpringBootContextLoader.java:563) ~[spring-boot-test-3.5.3.jar:3.5.3]
	at org.springframework.boot.test.context.SpringBootContextLoader.loadContext(SpringBootContextLoader.java:144) ~[spring-boot-test-3.5.3.jar:3.5.3]
	at org.springframework.boot.test.context.SpringBootContextLoader.loadContext(SpringBootContextLoader.java:110) ~[spring-boot-test-3.5.3.jar:3.5.3]
	at org.springframework.test.context.cache.DefaultCacheAwareContextLoaderDelegate.loadContextInternal(DefaultCacheAwareContextLoaderDelegate.java:225) ~[spring-test-6.2.8.jar:6.2.8]
	at org.springframework.test.context.cache.DefaultCacheAwareContextLoaderDelegate.loadContext(DefaultCacheAwareContextLoaderDelegate.java:152) ~[spring-test-6.2.8.jar:6.2.8]
	at org.springframework.test.context.support.DefaultTestContext.getApplicationContext(DefaultTestContext.java:130) ~[spring-test-6.2.8.jar:6.2.8]
	at org.springframework.test.context.web.ServletTestExecutionListener.setUpRequestContextIfNecessary(ServletTestExecutionListener.java:200) ~[spring-test-6.2.8.jar:6.2.8]
	at org.springframework.test.context.web.ServletTestExecutionListener.prepareTestInstance(ServletTestExecutionListener.java:139) ~[spring-test-6.2.8.jar:6.2.8]
	at org.springframework.test.context.TestContextManager.prepareTestInstance(TestContextManager.java:260) ~[spring-test-6.2.8.jar:6.2.8]
	at org.springframework.test.context.junit.jupiter.SpringExtension.postProcessTestInstance(SpringExtension.java:159) ~[spring-test-6.2.8.jar:6.2.8]
	at org.junit.jupiter.engine.descriptor.ClassBasedTestDescriptor.lambda$invokeTestInstancePostProcessors$10(ClassBasedTestDescriptor.java:383) ~[junit-jupiter-engine-5.12.2.jar:5.12.2]
	at org.junit.jupiter.engine.descriptor.ClassBasedTestDescriptor.executeAndMaskThrowable(ClassBasedTestDescriptor.java:388) ~[junit-jupiter-engine-5.12.2.jar:5.12.2]
	at org.junit.jupiter.engine.descriptor.ClassBasedTestDescriptor.lambda$invokeTestInstancePostProcessors$11(ClassBasedTestDescriptor.java:382) ~[junit-jupiter-engine-5.12.2.jar:5.12.2]
	at java.base/java.util.stream.ForEachOps$ForEachOp$OfRef.accept(ForEachOps.java:183) ~[na:na]
	at java.base/java.util.stream.ReferencePipeline$3$1.accept(ReferencePipeline.java:197) ~[na:na]
	at java.base/java.util.stream.ReferencePipeline$2$1.accept(ReferencePipeline.java:179) ~[na:na]
	at java.base/java.util.stream.ReferencePipeline$3$1.accept(ReferencePipeline.java:197) ~[na:na]
	at java.base/java.util.ArrayList$ArrayListSpliterator.forEachRemaining(ArrayList.java:1625) ~[na:na]
	at java.base/java.util.stream.AbstractPipeline.copyInto(AbstractPipeline.java:509) ~[na:na]
	at java.base/java.util.stream.AbstractPipeline.wrapAndCopyInto(AbstractPipeline.java:499) ~[na:na]
	at java.base/java.util.stream.ForEachOps$ForEachOp.evaluateSequential(ForEachOps.java:150) ~[na:na]
	at java.base/java.util.stream.ForEachOps$ForEachOp$OfRef.evaluateSequential(ForEachOps.java:173) ~[na:na]
	at java.base/java.util.stream.AbstractPipeline.evaluate(AbstractPipeline.java:234) ~[na:na]
	at java.base/java.util.stream.ReferencePipeline.forEach(ReferencePipeline.java:596) ~[na:na]
	at org.junit.jupiter.engine.descriptor.ClassBasedTestDescriptor.invokeTestInstancePostProcessors(ClassBasedTestDescriptor.java:382) ~[junit-jupiter-engine-5.12.2.jar:5.12.2]
	at org.junit.jupiter.engine.descriptor.ClassBasedTestDescriptor.lambda$instantiateAndPostProcessTestInstance$6(ClassBasedTestDescriptor.java:293) ~[junit-jupiter-engine-5.12.2.jar:5.12.2]
	at org.junit.platform.engine.support.hierarchical.ThrowableCollector.execute(ThrowableCollector.java:73) ~[junit-platform-engine-1.12.2.jar:1.12.2]
	at org.junit.jupiter.engine.descriptor.ClassBasedTestDescriptor.instantiateAndPostProcessTestInstance(ClassBasedTestDescriptor.java:292) ~[junit-jupiter-engine-5.12.2.jar:5.12.2]
	at org.junit.jupiter.engine.descriptor.ClassBasedTestDescriptor.lambda$testInstancesProvider$4(ClassBasedTestDescriptor.java:281) ~[junit-jupiter-engine-5.12.2.jar:5.12.2]
	at java.base/java.util.Optional.orElseGet(Optional.java:364) ~[na:na]
	at org.junit.jupiter.engine.descriptor.ClassBasedTestDescriptor.lambda$testInstancesProvider$5(ClassBasedTestDescriptor.java:280) ~[junit-jupiter-engine-5.12.2.jar:5.12.2]
	at org.junit.jupiter.engine.execution.TestInstancesProvider.getTestInstances(TestInstancesProvider.java:27) ~[junit-jupiter-engine-5.12.2.jar:5.12.2]
	at org.junit.jupiter.engine.descriptor.TestMethodTestDescriptor.lambda$prepare$0(TestMethodTestDescriptor.java:112) ~[junit-jupiter-engine-5.12.2.jar:5.12.2]
	at org.junit.platform.engine.support.hierarchical.ThrowableCollector.execute(ThrowableCollector.java:73) ~[junit-platform-engine-1.12.2.jar:1.12.2]
	at org.junit.jupiter.engine.descriptor.TestMethodTestDescriptor.prepare(TestMethodTestDescriptor.java:111) ~[junit-jupiter-engine-5.12.2.jar:5.12.2]
	at org.junit.jupiter.engine.descriptor.TestMethodTestDescriptor.prepare(TestMethodTestDescriptor.java:69) ~[junit-jupiter-engine-5.12.2.jar:5.12.2]
	at org.junit.platform.engine.support.hierarchical.NodeTestTask.lambda$prepare$2(NodeTestTask.java:128) ~[junit-platform-engine-1.12.2.jar:1.12.2]
	at org.junit.platform.engine.support.hierarchical.ThrowableCollector.execute(ThrowableCollector.java:73) ~[junit-platform-engine-1.12.2.jar:1.12.2]
	at org.junit.platform.engine.support.hierarchical.NodeTestTask.prepare(NodeTestTask.java:128) ~[junit-platform-engine-1.12.2.jar:1.12.2]
	at org.junit.platform.engine.support.hierarchical.NodeTestTask.execute(NodeTestTask.java:95) ~[junit-platform-engine-1.12.2.jar:1.12.2]
	at java.base/java.util.ArrayList.forEach(ArrayList.java:1511) ~[na:na]
	at org.junit.platform.engine.support.hierarchical.SameThreadHierarchicalTestExecutorService.invokeAll(SameThreadHierarchicalTestExecutorService.java:41) ~[junit-platform-engine-1.12.2.jar:1.12.2]
	at org.junit.platform.engine.support.hierarchical.NodeTestTask.lambda$executeRecursively$6(NodeTestTask.java:160) ~[junit-platform-engine-1.12.2.jar:1.12.2]
	at org.junit.platform.engine.support.hierarchical.ThrowableCollector.execute(ThrowableCollector.java:73) ~[junit-platform-engine-1.12.2.jar:1.12.2]
	at org.junit.platform.engine.support.hierarchical.NodeTestTask.lambda$executeRecursively$8(NodeTestTask.java:146) ~[junit-platform-engine-1.12.2.jar:1.12.2]
	at org.junit.platform.engine.support.hierarchical.Node.around(Node.java:137) ~[junit-platform-engine-1.12.2.jar:1.12.2]
	at org.junit.platform.engine.support.hierarchical.NodeTestTask.lambda$executeRecursively$9(NodeTestTask.java:144) ~[junit-platform-engine-1.12.2.jar:1.12.2]
	at org.junit.platform.engine.support.hierarchical.ThrowableCollector.execute(ThrowableCollector.java:73) ~[junit-platform-engine-1.12.2.jar:1.12.2]
	at org.junit.platform.engine.support.hierarchical.NodeTestTask.executeRecursively(NodeTestTask.java:143) ~[junit-platform-engine-1.12.2.jar:1.12.2]
	at org.junit.platform.engine.support.hierarchical.NodeTestTask.execute(NodeTestTask.java:100) ~[junit-platform-engine-1.12.2.jar:1.12.2]
	at java.base/java.util.ArrayList.forEach(ArrayList.java:1511) ~[na:na]
	at org.junit.platform.engine.support.hierarchical.SameThreadHierarchicalTestExecutorService.invokeAll(SameThreadHierarchicalTestExecutorService.java:41) ~[junit-platform-engine-1.12.2.jar:1.12.2]
	at org.junit.platform.engine.support.hierarchical.NodeTestTask.lambda$executeRecursively$6(NodeTestTask.java:160) ~[junit-platform-engine-1.12.2.jar:1.12.2]
	at org.junit.platform.engine.support.hierarchical.ThrowableCollector.execute(ThrowableCollector.java:73) ~[junit-platform-engine-1.12.2.jar:1.12.2]
	at org.junit.platform.engine.support.hierarchical.NodeTestTask.lambda$executeRecursively$8(NodeTestTask.java:146) ~[junit-platform-engine-1.12.2.jar:1.12.2]
	at org.junit.platform.engine.support.hierarchical.Node.around(Node.java:137) ~[junit-platform-engine-1.12.2.jar:1.12.2]
	at org.junit.platform.engine.support.hierarchical.NodeTestTask.lambda$executeRecursively$9(NodeTestTask.java:144) ~[junit-platform-engine-1.12.2.jar:1.12.2]
	at org.junit.platform.engine.support.hierarchical.ThrowableCollector.execute(ThrowableCollector.java:73) ~[junit-platform-engine-1.12.2.jar:1.12.2]
	at org.junit.platform.engine.support.hierarchical.NodeTestTask.executeRecursively(NodeTestTask.java:143) ~[junit-platform-engine-1.12.2.jar:1.12.2]
	at org.junit.platform.engine.support.hierarchical.NodeTestTask.execute(NodeTestTask.java:100) ~[junit-platform-engine-1.12.2.jar:1.12.2]
	at org.junit.platform.engine.support.hierarchical.SameThreadHierarchicalTestExecutorService.submit(SameThreadHierarchicalTestExecutorService.java:35) ~[junit-platform-engine-1.12.2.jar:1.12.2]
	at org.junit.platform.engine.support.hierarchical.HierarchicalTestExecutor.execute(HierarchicalTestExecutor.java:57) ~[junit-platform-engine-1.12.2.jar:1.12.2]
	at org.junit.platform.engine.support.hierarchical.HierarchicalTestEngine.execute(HierarchicalTestEngine.java:54) ~[junit-platform-engine-1.12.2.jar:1.12.2]
	at org.junit.platform.launcher.core.EngineExecutionOrchestrator.execute(EngineExecutionOrchestrator.java:201) ~[junit-platform-launcher-1.12.2.jar:1.12.2]
	at org.junit.platform.launcher.core.EngineExecutionOrchestrator.execute(EngineExecutionOrchestrator.java:170) ~[junit-platform-launcher-1.12.2.jar:1.12.2]
	at org.junit.platform.launcher.core.EngineExecutionOrchestrator.execute(EngineExecutionOrchestrator.java:94) ~[junit-platform-launcher-1.12.2.jar:1.12.2]
	at org.junit.platform.launcher.core.EngineExecutionOrchestrator.lambda$execute$0(EngineExecutionOrchestrator.java:59) ~[junit-platform-launcher-1.12.2.jar:1.12.2]
	at org.junit.platform.launcher.core.EngineExecutionOrchestrator.withInterceptedStreams(EngineExecutionOrchestrator.java:142) ~[junit-platform-launcher-1.12.2.jar:1.12.2]
	at org.junit.platform.launcher.core.EngineExecutionOrchestrator.execute(EngineExecutionOrchestrator.java:58) ~[junit-platform-launcher-1.12.2.jar:1.12.2]
	at org.junit.platform.launcher.core.DefaultLauncher.execute(DefaultLauncher.java:103) ~[junit-platform-launcher-1.12.2.jar:1.12.2]
	at org.junit.platform.launcher.core.DefaultLauncher.execute(DefaultLauncher.java:85) ~[junit-platform-launcher-1.12.2.jar:1.12.2]
	at org.junit.platform.launcher.core.DelegatingLauncher.execute(DelegatingLauncher.java:47) ~[junit-platform-launcher-1.12.2.jar:1.12.2]
	at org.junit.platform.launcher.core.InterceptingLauncher.lambda$execute$1(InterceptingLauncher.java:39) ~[junit-platform-launcher-1.12.2.jar:1.12.2]
	at org.junit.platform.launcher.core.ClasspathAlignmentCheckingLauncherInterceptor.intercept(ClasspathAlignmentCheckingLauncherInterceptor.java:25) ~[junit-platform-launcher-1.12.2.jar:1.12.2]
	at org.junit.platform.launcher.core.InterceptingLauncher.execute(InterceptingLauncher.java:38) ~[junit-platform-launcher-1.12.2.jar:1.12.2]
	at org.junit.platform.launcher.core.DelegatingLauncher.execute(DelegatingLauncher.java:47) ~[junit-platform-launcher-1.12.2.jar:1.12.2]
	at org.apache.maven.surefire.junitplatform.LazyLauncher.execute(LazyLauncher.java:56) ~[surefire-junit-platform-3.5.3.jar:3.5.3]
	at org.apache.maven.surefire.junitplatform.JUnitPlatformProvider.execute(JUnitPlatformProvider.java:194) ~[surefire-junit-platform-3.5.3.jar:3.5.3]
	at org.apache.maven.surefire.junitplatform.JUnitPlatformProvider.invokeAllTests(JUnitPlatformProvider.java:150) ~[surefire-junit-platform-3.5.3.jar:3.5.3]
	at org.apache.maven.surefire.junitplatform.JUnitPlatformProvider.invoke(JUnitPlatformProvider.java:124) ~[surefire-junit-platform-3.5.3.jar:3.5.3]
	at org.apache.maven.surefire.booter.ForkedBooter.runSuitesInProcess(ForkedBooter.java:385) ~[surefire-booter-3.5.3.jar:3.5.3]
	at org.apache.maven.surefire.booter.ForkedBooter.execute(ForkedBooter.java:162) ~[surefire-booter-3.5.3.jar:3.5.3]
	at org.apache.maven.surefire.booter.ForkedBooter.run(ForkedBooter.java:507) ~[surefire-booter-3.5.3.jar:3.5.3]
	at org.apache.maven.surefire.booter.ForkedBooter.main(ForkedBooter.java:495) ~[surefire-booter-3.5.3.jar:3.5.3]
Caused by: org.springframework.dao.InvalidDataAccessResourceUsageException: could not execute statement [ERROR: column "role" is of type user_role but expression is of type character varying
  Hint: You will need to rewrite or cast the expression.
  Position: 203] [update users set address=?,created_at=?,date_of_birth=?,email=?,email_verified=?,failed_login_attempts=?,first_name=?,is_active=?,last_login_at=?,last_name=?,password_hash=?,phone=?,role=?,ssn_hash=?,updated_at=?,username=? where user_id=?]; SQL [update users set address=?,created_at=?,date_of_birth=?,email=?,email_verified=?,failed_login_attempts=?,first_name=?,is_active=?,last_login_at=?,last_name=?,password_hash=?,phone=?,role=?,ssn_hash=?,updated_at=?,username=? where user_id=?]
	at org.springframework.orm.jpa.vendor.HibernateJpaDialect.convertHibernateAccessException(HibernateJpaDialect.java:281) ~[spring-orm-6.2.8.jar:6.2.8]
	at org.springframework.orm.jpa.vendor.HibernateJpaDialect.convertHibernateAccessException(HibernateJpaDialect.java:256) ~[spring-orm-6.2.8.jar:6.2.8]
	at org.springframework.orm.jpa.vendor.HibernateJpaDialect.translateExceptionIfPossible(HibernateJpaDialect.java:241) ~[spring-orm-6.2.8.jar:6.2.8]
	at org.springframework.orm.jpa.JpaTransactionManager.doCommit(JpaTransactionManager.java:566) ~[spring-orm-6.2.8.jar:6.2.8]
	at org.springframework.transaction.support.AbstractPlatformTransactionManager.processCommit(AbstractPlatformTransactionManager.java:795) ~[spring-tx-6.2.8.jar:6.2.8]
	at org.springframework.transaction.support.AbstractPlatformTransactionManager.commit(AbstractPlatformTransactionManager.java:758) ~[spring-tx-6.2.8.jar:6.2.8]
	at org.springframework.transaction.interceptor.TransactionAspectSupport.commitTransactionAfterReturning(TransactionAspectSupport.java:698) ~[spring-tx-6.2.8.jar:6.2.8]
	at org.springframework.transaction.interceptor.TransactionAspectSupport.invokeWithinTransaction(TransactionAspectSupport.java:416) ~[spring-tx-6.2.8.jar:6.2.8]
	at org.springframework.transaction.interceptor.TransactionInterceptor.invoke(TransactionInterceptor.java:119) ~[spring-tx-6.2.8.jar:6.2.8]
	at org.springframework.aop.framework.ReflectiveMethodInvocation.proceed(ReflectiveMethodInvocation.java:184) ~[spring-aop-6.2.8.jar:6.2.8]
	at org.springframework.dao.support.PersistenceExceptionTranslationInterceptor.invoke(PersistenceExceptionTranslationInterceptor.java:138) ~[spring-tx-6.2.8.jar:6.2.8]
	at org.springframework.aop.framework.ReflectiveMethodInvocation.proceed(ReflectiveMethodInvocation.java:184) ~[spring-aop-6.2.8.jar:6.2.8]
	at org.springframework.data.jpa.repository.support.CrudMethodMetadataPostProcessor$CrudMethodMetadataPopulatingMethodInterceptor.invoke(CrudMethodMetadataPostProcessor.java:165) ~[spring-data-jpa-3.5.1.jar:3.5.1]
	at org.springframework.aop.framework.ReflectiveMethodInvocation.proceed(ReflectiveMethodInvocation.java:184) ~[spring-aop-6.2.8.jar:6.2.8]
	at org.springframework.aop.framework.JdkDynamicAopProxy.invoke(JdkDynamicAopProxy.java:223) ~[spring-aop-6.2.8.jar:6.2.8]
	at jdk.proxy2/jdk.proxy2.$Proxy140.save(Unknown Source) ~[na:na]
	at com.bank.demo.config.PasswordMigrationService.migratePasswords(PasswordMigrationService.java:30) ~[classes/:na]
	at java.base/jdk.internal.reflect.NativeMethodAccessorImpl.invoke0(Native Method) ~[na:na]
	at java.base/jdk.internal.reflect.NativeMethodAccessorImpl.invoke(NativeMethodAccessorImpl.java:77) ~[na:na]
	at java.base/jdk.internal.reflect.DelegatingMethodAccessorImpl.invoke(DelegatingMethodAccessorImpl.java:43) ~[na:na]
	at java.base/java.lang.reflect.Method.invoke(Method.java:569) ~[na:na]
	at org.springframework.beans.factory.annotation.InitDestroyAnnotationBeanPostProcessor$LifecycleMethod.invoke(InitDestroyAnnotationBeanPostProcessor.java:457) ~[spring-beans-6.2.8.jar:6.2.8]
	at org.springframework.beans.factory.annotation.InitDestroyAnnotationBeanPostProcessor$LifecycleMetadata.invokeInitMethods(InitDestroyAnnotationBeanPostProcessor.java:401) ~[spring-beans-6.2.8.jar:6.2.8]
	at org.springframework.beans.factory.annotation.InitDestroyAnnotationBeanPostProcessor.postProcessBeforeInitialization(InitDestroyAnnotationBeanPostProcessor.java:219) ~[spring-beans-6.2.8.jar:6.2.8]
	... 104 common frames omitted
Caused by: org.hibernate.exception.SQLGrammarException: could not execute statement [ERROR: column "role" is of type user_role but expression is of type character varying
  Hint: You will need to rewrite or cast the expression.
  Position: 203] [update users set address=?,created_at=?,date_of_birth=?,email=?,email_verified=?,failed_login_attempts=?,first_name=?,is_active=?,last_login_at=?,last_name=?,password_hash=?,phone=?,role=?,ssn_hash=?,updated_at=?,username=? where user_id=?]
	at org.hibernate.exception.internal.SQLStateConversionDelegate.convert(SQLStateConversionDelegate.java:91) ~[hibernate-core-6.6.18.Final.jar:6.6.18.Final]
	at org.hibernate.exception.internal.StandardSQLExceptionConverter.convert(StandardSQLExceptionConverter.java:58) ~[hibernate-core-6.6.18.Final.jar:6.6.18.Final]
	at org.hibernate.engine.jdbc.spi.SqlExceptionHelper.convert(SqlExceptionHelper.java:108) ~[hibernate-core-6.6.18.Final.jar:6.6.18.Final]
	at org.hibernate.engine.jdbc.internal.ResultSetReturnImpl.executeUpdate(ResultSetReturnImpl.java:197) ~[hibernate-core-6.6.18.Final.jar:6.6.18.Final]
	at org.hibernate.engine.jdbc.mutation.internal.AbstractMutationExecutor.performNonBatchedMutation(AbstractMutationExecutor.java:134) ~[hibernate-core-6.6.18.Final.jar:6.6.18.Final]
	at org.hibernate.engine.jdbc.mutation.internal.MutationExecutorSingleNonBatched.performNonBatchedOperations(MutationExecutorSingleNonBatched.java:55) ~[hibernate-core-6.6.18.Final.jar:6.6.18.Final]
	at org.hibernate.engine.jdbc.mutation.internal.AbstractMutationExecutor.execute(AbstractMutationExecutor.java:55) ~[hibernate-core-6.6.18.Final.jar:6.6.18.Final]
	at org.hibernate.persister.entity.mutation.UpdateCoordinatorStandard.doStaticUpdate(UpdateCoordinatorStandard.java:781) ~[hibernate-core-6.6.18.Final.jar:6.6.18.Final]
	at org.hibernate.persister.entity.mutation.UpdateCoordinatorStandard.performUpdate(UpdateCoordinatorStandard.java:328) ~[hibernate-core-6.6.18.Final.jar:6.6.18.Final]
	at org.hibernate.persister.entity.mutation.UpdateCoordinatorStandard.update(UpdateCoordinatorStandard.java:245) ~[hibernate-core-6.6.18.Final.jar:6.6.18.Final]
	at org.hibernate.action.internal.EntityUpdateAction.execute(EntityUpdateAction.java:169) ~[hibernate-core-6.6.18.Final.jar:6.6.18.Final]
	at org.hibernate.engine.spi.ActionQueue.executeActions(ActionQueue.java:644) ~[hibernate-core-6.6.18.Final.jar:6.6.18.Final]
	at org.hibernate.engine.spi.ActionQueue.executeActions(ActionQueue.java:511) ~[hibernate-core-6.6.18.Final.jar:6.6.18.Final]
	at org.hibernate.event.internal.AbstractFlushingEventListener.performExecutions(AbstractFlushingEventListener.java:414) ~[hibernate-core-6.6.18.Final.jar:6.6.18.Final]
	at org.hibernate.event.internal.DefaultFlushEventListener.onFlush(DefaultFlushEventListener.java:41) ~[hibernate-core-6.6.18.Final.jar:6.6.18.Final]
	at org.hibernate.event.service.internal.EventListenerGroupImpl.fireEventOnEachListener(EventListenerGroupImpl.java:127) ~[hibernate-core-6.6.18.Final.jar:6.6.18.Final]
	at org.hibernate.internal.SessionImpl.doFlush(SessionImpl.java:1429) ~[hibernate-core-6.6.18.Final.jar:6.6.18.Final]
	at org.hibernate.internal.SessionImpl.managedFlush(SessionImpl.java:491) ~[hibernate-core-6.6.18.Final.jar:6.6.18.Final]
	at org.hibernate.internal.SessionImpl.flushBeforeTransactionCompletion(SessionImpl.java:2354) ~[hibernate-core-6.6.18.Final.jar:6.6.18.Final]
	at org.hibernate.internal.SessionImpl.beforeTransactionCompletion(SessionImpl.java:1978) ~[hibernate-core-6.6.18.Final.jar:6.6.18.Final]
	at org.hibernate.engine.jdbc.internal.JdbcCoordinatorImpl.beforeTransactionCompletion(JdbcCoordinatorImpl.java:439) ~[hibernate-core-6.6.18.Final.jar:6.6.18.Final]
	at org.hibernate.resource.transaction.backend.jdbc.internal.JdbcResourceLocalTransactionCoordinatorImpl.beforeCompletionCallback(JdbcResourceLocalTransactionCoordinatorImpl.java:169) ~[hibernate-core-6.6.18.Final.jar:6.6.18.Final]
	at org.hibernate.resource.transaction.backend.jdbc.internal.JdbcResourceLocalTransactionCoordinatorImpl$TransactionDriverControlImpl.commit(JdbcResourceLocalTransactionCoordinatorImpl.java:267) ~[hibernate-core-6.6.18.Final.jar:6.6.18.Final]
	at org.hibernate.engine.transaction.internal.TransactionImpl.commit(TransactionImpl.java:101) ~[hibernate-core-6.6.18.Final.jar:6.6.18.Final]
	at org.springframework.orm.jpa.JpaTransactionManager.doCommit(JpaTransactionManager.java:562) ~[spring-orm-6.2.8.jar:6.2.8]
	... 124 common frames omitted
Caused by: org.postgresql.util.PSQLException: ERROR: column "role" is of type user_role but expression is of type character varying
  Hint: You will need to rewrite or cast the expression.
  Position: 203
	at org.postgresql.core.v3.QueryExecutorImpl.receiveErrorResponse(QueryExecutorImpl.java:2734) ~[postgresql-42.7.7.jar:42.7.7]
	at org.postgresql.core.v3.QueryExecutorImpl.processResults(QueryExecutorImpl.java:2421) ~[postgresql-42.7.7.jar:42.7.7]
	at org.postgresql.core.v3.QueryExecutorImpl.execute(QueryExecutorImpl.java:372) ~[postgresql-42.7.7.jar:42.7.7]
	at org.postgresql.jdbc.PgStatement.executeInternal(PgStatement.java:518) ~[postgresql-42.7.7.jar:42.7.7]
	at org.postgresql.jdbc.PgStatement.execute(PgStatement.java:435) ~[postgresql-42.7.7.jar:42.7.7]
	at org.postgresql.jdbc.PgPreparedStatement.executeWithFlags(PgPreparedStatement.java:196) ~[postgresql-42.7.7.jar:42.7.7]
	at org.postgresql.jdbc.PgPreparedStatement.executeUpdate(PgPreparedStatement.java:157) ~[postgresql-42.7.7.jar:42.7.7]
	at com.zaxxer.hikari.pool.ProxyPreparedStatement.executeUpdate(ProxyPreparedStatement.java:61) ~[HikariCP-6.3.0.jar:na]
	at com.zaxxer.hikari.pool.HikariProxyPreparedStatement.executeUpdate(HikariProxyPreparedStatement.java) ~[HikariCP-6.3.0.jar:na]
	at org.hibernate.engine.jdbc.internal.ResultSetReturnImpl.executeUpdate(ResultSetReturnImpl.java:194) ~[hibernate-core-6.6.18.Final.jar:6.6.18.Final]
	... 145 common frames omitted

2025-08-08T01:31:36.375-04:00  WARN 14056 --- [banking-api] [           main] o.s.test.context.TestContextManager      : Caught exception while allowing TestExecutionListener [org.springframework.test.context.web.ServletTestExecutionListener] to prepare test instance [com.bank.demo.BankingApiApplicationTests@246ee6d8]

java.lang.IllegalStateException: Failed to load ApplicationContext for [WebMergedContextConfiguration@45a9f3d4 testClass = com.bank.demo.BankingApiApplicationTests, locations = [], classes = [com.bank.demo.BankingApiApplication], contextInitializerClasses = [], activeProfiles = [], propertySourceDescriptors = [], propertySourceProperties = ["org.springframework.boot.test.context.SpringBootTestContextBootstrapper=true"], contextCustomizers = [org.springframework.boot.test.context.filter.ExcludeFilterContextCustomizer@792b749c, org.springframework.boot.test.json.DuplicateJsonObjectContextCustomizerFactory$DuplicateJsonObjectContextCustomizer@305ffe9e, org.springframework.boot.test.mock.mockito.MockitoContextCustomizer@0, org.springframework.boot.test.web.client.TestRestTemplateContextCustomizer@5a59ca5e, org.springframework.boot.test.web.reactor.netty.DisableReactorResourceFactoryGlobalResourcesContextCustomizerFactory$DisableReactorResourceFactoryGlobalResourcesContextCustomizerCustomizer@eadd4fb, org.springframework.boot.test.autoconfigure.OnFailureConditionReportContextCustomizerFactory$OnFailureConditionReportContextCustomizer@43f02ef2, org.springframework.boot.test.autoconfigure.actuate.observability.ObservabilityContextCustomizerFactory$DisableObservabilityContextCustomizer@1f, org.springframework.boot.test.autoconfigure.properties.PropertyMappingContextCustomizer@0, org.springframework.boot.test.autoconfigure.web.servlet.WebDriverContextCustomizer@c05fddc, org.springframework.test.context.support.DynamicPropertiesContextCustomizer@0, org.springframework.boot.test.context.SpringBootTestAnnotation@7391d966], resourceBasePath = "src/main/webapp", contextLoader = org.springframework.boot.test.context.SpringBootContextLoader, parent = null]
	at org.springframework.test.context.cache.DefaultCacheAwareContextLoaderDelegate.loadContext(DefaultCacheAwareContextLoaderDelegate.java:180) ~[spring-test-6.2.8.jar:6.2.8]
	at org.springframework.test.context.support.DefaultTestContext.getApplicationContext(DefaultTestContext.java:130) ~[spring-test-6.2.8.jar:6.2.8]
	at org.springframework.test.context.web.ServletTestExecutionListener.setUpRequestContextIfNecessary(ServletTestExecutionListener.java:200) ~[spring-test-6.2.8.jar:6.2.8]
	at org.springframework.test.context.web.ServletTestExecutionListener.prepareTestInstance(ServletTestExecutionListener.java:139) ~[spring-test-6.2.8.jar:6.2.8]
	at org.springframework.test.context.TestContextManager.prepareTestInstance(TestContextManager.java:260) ~[spring-test-6.2.8.jar:6.2.8]
	at org.springframework.test.context.junit.jupiter.SpringExtension.postProcessTestInstance(SpringExtension.java:159) ~[spring-test-6.2.8.jar:6.2.8]
	at org.junit.jupiter.engine.descriptor.ClassBasedTestDescriptor.lambda$invokeTestInstancePostProcessors$10(ClassBasedTestDescriptor.java:383) ~[junit-jupiter-engine-5.12.2.jar:5.12.2]
	at org.junit.jupiter.engine.descriptor.ClassBasedTestDescriptor.executeAndMaskThrowable(ClassBasedTestDescriptor.java:388) ~[junit-jupiter-engine-5.12.2.jar:5.12.2]
	at org.junit.jupiter.engine.descriptor.ClassBasedTestDescriptor.lambda$invokeTestInstancePostProcessors$11(ClassBasedTestDescriptor.java:382) ~[junit-jupiter-engine-5.12.2.jar:5.12.2]
	at java.base/java.util.stream.ForEachOps$ForEachOp$OfRef.accept(ForEachOps.java:183) ~[na:na]
	at java.base/java.util.stream.ReferencePipeline$3$1.accept(ReferencePipeline.java:197) ~[na:na]
	at java.base/java.util.stream.ReferencePipeline$2$1.accept(ReferencePipeline.java:179) ~[na:na]
	at java.base/java.util.stream.ReferencePipeline$3$1.accept(ReferencePipeline.java:197) ~[na:na]
	at java.base/java.util.ArrayList$ArrayListSpliterator.forEachRemaining(ArrayList.java:1625) ~[na:na]
	at java.base/java.util.stream.AbstractPipeline.copyInto(AbstractPipeline.java:509) ~[na:na]
	at java.base/java.util.stream.AbstractPipeline.wrapAndCopyInto(AbstractPipeline.java:499) ~[na:na]
	at java.base/java.util.stream.ForEachOps$ForEachOp.evaluateSequential(ForEachOps.java:150) ~[na:na]
	at java.base/java.util.stream.ForEachOps$ForEachOp$OfRef.evaluateSequential(ForEachOps.java:173) ~[na:na]
	at java.base/java.util.stream.AbstractPipeline.evaluate(AbstractPipeline.java:234) ~[na:na]
	at java.base/java.util.stream.ReferencePipeline.forEach(ReferencePipeline.java:596) ~[na:na]
	at org.junit.jupiter.engine.descriptor.ClassBasedTestDescriptor.invokeTestInstancePostProcessors(ClassBasedTestDescriptor.java:382) ~[junit-jupiter-engine-5.12.2.jar:5.12.2]
	at org.junit.jupiter.engine.descriptor.ClassBasedTestDescriptor.lambda$instantiateAndPostProcessTestInstance$6(ClassBasedTestDescriptor.java:293) ~[junit-jupiter-engine-5.12.2.jar:5.12.2]
	at org.junit.platform.engine.support.hierarchical.ThrowableCollector.execute(ThrowableCollector.java:73) ~[junit-platform-engine-1.12.2.jar:1.12.2]
	at org.junit.jupiter.engine.descriptor.ClassBasedTestDescriptor.instantiateAndPostProcessTestInstance(ClassBasedTestDescriptor.java:292) ~[junit-jupiter-engine-5.12.2.jar:5.12.2]
	at org.junit.jupiter.engine.descriptor.ClassBasedTestDescriptor.lambda$testInstancesProvider$4(ClassBasedTestDescriptor.java:281) ~[junit-jupiter-engine-5.12.2.jar:5.12.2]
	at java.base/java.util.Optional.orElseGet(Optional.java:364) ~[na:na]
	at org.junit.jupiter.engine.descriptor.ClassBasedTestDescriptor.lambda$testInstancesProvider$5(ClassBasedTestDescriptor.java:280) ~[junit-jupiter-engine-5.12.2.jar:5.12.2]
	at org.junit.jupiter.engine.execution.TestInstancesProvider.getTestInstances(TestInstancesProvider.java:27) ~[junit-jupiter-engine-5.12.2.jar:5.12.2]
	at org.junit.jupiter.engine.descriptor.TestMethodTestDescriptor.lambda$prepare$0(TestMethodTestDescriptor.java:112) ~[junit-jupiter-engine-5.12.2.jar:5.12.2]
	at org.junit.platform.engine.support.hierarchical.ThrowableCollector.execute(ThrowableCollector.java:73) ~[junit-platform-engine-1.12.2.jar:1.12.2]
	at org.junit.jupiter.engine.descriptor.TestMethodTestDescriptor.prepare(TestMethodTestDescriptor.java:111) ~[junit-jupiter-engine-5.12.2.jar:5.12.2]
	at org.junit.jupiter.engine.descriptor.TestMethodTestDescriptor.prepare(TestMethodTestDescriptor.java:69) ~[junit-jupiter-engine-5.12.2.jar:5.12.2]
	at org.junit.platform.engine.support.hierarchical.NodeTestTask.lambda$prepare$2(NodeTestTask.java:128) ~[junit-platform-engine-1.12.2.jar:1.12.2]
	at org.junit.platform.engine.support.hierarchical.ThrowableCollector.execute(ThrowableCollector.java:73) ~[junit-platform-engine-1.12.2.jar:1.12.2]
	at org.junit.platform.engine.support.hierarchical.NodeTestTask.prepare(NodeTestTask.java:128) ~[junit-platform-engine-1.12.2.jar:1.12.2]
	at org.junit.platform.engine.support.hierarchical.NodeTestTask.execute(NodeTestTask.java:95) ~[junit-platform-engine-1.12.2.jar:1.12.2]
	at java.base/java.util.ArrayList.forEach(ArrayList.java:1511) ~[na:na]
	at org.junit.platform.engine.support.hierarchical.SameThreadHierarchicalTestExecutorService.invokeAll(SameThreadHierarchicalTestExecutorService.java:41) ~[junit-platform-engine-1.12.2.jar:1.12.2]
	at org.junit.platform.engine.support.hierarchical.NodeTestTask.lambda$executeRecursively$6(NodeTestTask.java:160) ~[junit-platform-engine-1.12.2.jar:1.12.2]
	at org.junit.platform.engine.support.hierarchical.ThrowableCollector.execute(ThrowableCollector.java:73) ~[junit-platform-engine-1.12.2.jar:1.12.2]
	at org.junit.platform.engine.support.hierarchical.NodeTestTask.lambda$executeRecursively$8(NodeTestTask.java:146) ~[junit-platform-engine-1.12.2.jar:1.12.2]
	at org.junit.platform.engine.support.hierarchical.Node.around(Node.java:137) ~[junit-platform-engine-1.12.2.jar:1.12.2]
	at org.junit.platform.engine.support.hierarchical.NodeTestTask.lambda$executeRecursively$9(NodeTestTask.java:144) ~[junit-platform-engine-1.12.2.jar:1.12.2]
	at org.junit.platform.engine.support.hierarchical.ThrowableCollector.execute(ThrowableCollector.java:73) ~[junit-platform-engine-1.12.2.jar:1.12.2]
	at org.junit.platform.engine.support.hierarchical.NodeTestTask.executeRecursively(NodeTestTask.java:143) ~[junit-platform-engine-1.12.2.jar:1.12.2]
	at org.junit.platform.engine.support.hierarchical.NodeTestTask.execute(NodeTestTask.java:100) ~[junit-platform-engine-1.12.2.jar:1.12.2]
	at java.base/java.util.ArrayList.forEach(ArrayList.java:1511) ~[na:na]
	at org.junit.platform.engine.support.hierarchical.SameThreadHierarchicalTestExecutorService.invokeAll(SameThreadHierarchicalTestExecutorService.java:41) ~[junit-platform-engine-1.12.2.jar:1.12.2]
	at org.junit.platform.engine.support.hierarchical.NodeTestTask.lambda$executeRecursively$6(NodeTestTask.java:160) ~[junit-platform-engine-1.12.2.jar:1.12.2]
	at org.junit.platform.engine.support.hierarchical.ThrowableCollector.execute(ThrowableCollector.java:73) ~[junit-platform-engine-1.12.2.jar:1.12.2]
	at org.junit.platform.engine.support.hierarchical.NodeTestTask.lambda$executeRecursively$8(NodeTestTask.java:146) ~[junit-platform-engine-1.12.2.jar:1.12.2]
	at org.junit.platform.engine.support.hierarchical.Node.around(Node.java:137) ~[junit-platform-engine-1.12.2.jar:1.12.2]
	at org.junit.platform.engine.support.hierarchical.NodeTestTask.lambda$executeRecursively$9(NodeTestTask.java:144) ~[junit-platform-engine-1.12.2.jar:1.12.2]
	at org.junit.platform.engine.support.hierarchical.ThrowableCollector.execute(ThrowableCollector.java:73) ~[junit-platform-engine-1.12.2.jar:1.12.2]
	at org.junit.platform.engine.support.hierarchical.NodeTestTask.executeRecursively(NodeTestTask.java:143) ~[junit-platform-engine-1.12.2.jar:1.12.2]
	at org.junit.platform.engine.support.hierarchical.NodeTestTask.execute(NodeTestTask.java:100) ~[junit-platform-engine-1.12.2.jar:1.12.2]
	at org.junit.platform.engine.support.hierarchical.SameThreadHierarchicalTestExecutorService.submit(SameThreadHierarchicalTestExecutorService.java:35) ~[junit-platform-engine-1.12.2.jar:1.12.2]
	at org.junit.platform.engine.support.hierarchical.HierarchicalTestExecutor.execute(HierarchicalTestExecutor.java:57) ~[junit-platform-engine-1.12.2.jar:1.12.2]
	at org.junit.platform.engine.support.hierarchical.HierarchicalTestEngine.execute(HierarchicalTestEngine.java:54) ~[junit-platform-engine-1.12.2.jar:1.12.2]
	at org.junit.platform.launcher.core.EngineExecutionOrchestrator.execute(EngineExecutionOrchestrator.java:201) ~[junit-platform-launcher-1.12.2.jar:1.12.2]
	at org.junit.platform.launcher.core.EngineExecutionOrchestrator.execute(EngineExecutionOrchestrator.java:170) ~[junit-platform-launcher-1.12.2.jar:1.12.2]
	at org.junit.platform.launcher.core.EngineExecutionOrchestrator.execute(EngineExecutionOrchestrator.java:94) ~[junit-platform-launcher-1.12.2.jar:1.12.2]
	at org.junit.platform.launcher.core.EngineExecutionOrchestrator.lambda$execute$0(EngineExecutionOrchestrator.java:59) ~[junit-platform-launcher-1.12.2.jar:1.12.2]
	at org.junit.platform.launcher.core.EngineExecutionOrchestrator.withInterceptedStreams(EngineExecutionOrchestrator.java:142) ~[junit-platform-launcher-1.12.2.jar:1.12.2]
	at org.junit.platform.launcher.core.EngineExecutionOrchestrator.execute(EngineExecutionOrchestrator.java:58) ~[junit-platform-launcher-1.12.2.jar:1.12.2]
	at org.junit.platform.launcher.core.DefaultLauncher.execute(DefaultLauncher.java:103) ~[junit-platform-launcher-1.12.2.jar:1.12.2]
	at org.junit.platform.launcher.core.DefaultLauncher.execute(DefaultLauncher.java:85) ~[junit-platform-launcher-1.12.2.jar:1.12.2]
	at org.junit.platform.launcher.core.DelegatingLauncher.execute(DelegatingLauncher.java:47) ~[junit-platform-launcher-1.12.2.jar:1.12.2]
	at org.junit.platform.launcher.core.InterceptingLauncher.lambda$execute$1(InterceptingLauncher.java:39) ~[junit-platform-launcher-1.12.2.jar:1.12.2]
	at org.junit.platform.launcher.core.ClasspathAlignmentCheckingLauncherInterceptor.intercept(ClasspathAlignmentCheckingLauncherInterceptor.java:25) ~[junit-platform-launcher-1.12.2.jar:1.12.2]
	at org.junit.platform.launcher.core.InterceptingLauncher.execute(InterceptingLauncher.java:38) ~[junit-platform-launcher-1.12.2.jar:1.12.2]
	at org.junit.platform.launcher.core.DelegatingLauncher.execute(DelegatingLauncher.java:47) ~[junit-platform-launcher-1.12.2.jar:1.12.2]
	at org.apache.maven.surefire.junitplatform.LazyLauncher.execute(LazyLauncher.java:56) ~[surefire-junit-platform-3.5.3.jar:3.5.3]
	at org.apache.maven.surefire.junitplatform.JUnitPlatformProvider.execute(JUnitPlatformProvider.java:194) ~[surefire-junit-platform-3.5.3.jar:3.5.3]
	at org.apache.maven.surefire.junitplatform.JUnitPlatformProvider.invokeAllTests(JUnitPlatformProvider.java:150) ~[surefire-junit-platform-3.5.3.jar:3.5.3]
	at org.apache.maven.surefire.junitplatform.JUnitPlatformProvider.invoke(JUnitPlatformProvider.java:124) ~[surefire-junit-platform-3.5.3.jar:3.5.3]
	at org.apache.maven.surefire.booter.ForkedBooter.runSuitesInProcess(ForkedBooter.java:385) ~[surefire-booter-3.5.3.jar:3.5.3]
	at org.apache.maven.surefire.booter.ForkedBooter.execute(ForkedBooter.java:162) ~[surefire-booter-3.5.3.jar:3.5.3]
	at org.apache.maven.surefire.booter.ForkedBooter.run(ForkedBooter.java:507) ~[surefire-booter-3.5.3.jar:3.5.3]
	at org.apache.maven.surefire.booter.ForkedBooter.main(ForkedBooter.java:495) ~[surefire-booter-3.5.3.jar:3.5.3]
Caused by: org.springframework.beans.factory.BeanCreationException: Error creating bean with name 'passwordMigrationService': Invocation of init method failed
	at org.springframework.beans.factory.annotation.InitDestroyAnnotationBeanPostProcessor.postProcessBeforeInitialization(InitDestroyAnnotationBeanPostProcessor.java:222) ~[spring-beans-6.2.8.jar:6.2.8]
	at org.springframework.beans.factory.support.AbstractAutowireCapableBeanFactory.applyBeanPostProcessorsBeforeInitialization(AbstractAutowireCapableBeanFactory.java:429) ~[spring-beans-6.2.8.jar:6.2.8]
	at org.springframework.beans.factory.support.AbstractAutowireCapableBeanFactory.initializeBean(AbstractAutowireCapableBeanFactory.java:1818) ~[spring-beans-6.2.8.jar:6.2.8]
	at org.springframework.beans.factory.support.AbstractAutowireCapableBeanFactory.doCreateBean(AbstractAutowireCapableBeanFactory.java:607) ~[spring-beans-6.2.8.jar:6.2.8]
	at org.springframework.beans.factory.support.AbstractAutowireCapableBeanFactory.createBean(AbstractAutowireCapableBeanFactory.java:529) ~[spring-beans-6.2.8.jar:6.2.8]
	at org.springframework.beans.factory.support.AbstractBeanFactory.lambda$doGetBean$0(AbstractBeanFactory.java:339) ~[spring-beans-6.2.8.jar:6.2.8]
	at org.springframework.beans.factory.support.DefaultSingletonBeanRegistry.getSingleton(DefaultSingletonBeanRegistry.java:373) ~[spring-beans-6.2.8.jar:6.2.8]
	at org.springframework.beans.factory.support.AbstractBeanFactory.doGetBean(AbstractBeanFactory.java:337) ~[spring-beans-6.2.8.jar:6.2.8]
	at org.springframework.beans.factory.support.AbstractBeanFactory.getBean(AbstractBeanFactory.java:202) ~[spring-beans-6.2.8.jar:6.2.8]
	at org.springframework.beans.factory.support.DefaultListableBeanFactory.instantiateSingleton(DefaultListableBeanFactory.java:1222) ~[spring-beans-6.2.8.jar:6.2.8]
	at org.springframework.beans.factory.support.DefaultListableBeanFactory.preInstantiateSingleton(DefaultListableBeanFactory.java:1188) ~[spring-beans-6.2.8.jar:6.2.8]
	at org.springframework.beans.factory.support.DefaultListableBeanFactory.preInstantiateSingletons(DefaultListableBeanFactory.java:1123) ~[spring-beans-6.2.8.jar:6.2.8]
	at org.springframework.context.support.AbstractApplicationContext.finishBeanFactoryInitialization(AbstractApplicationContext.java:987) ~[spring-context-6.2.8.jar:6.2.8]
	at org.springframework.context.support.AbstractApplicationContext.refresh(AbstractApplicationContext.java:627) ~[spring-context-6.2.8.jar:6.2.8]
	at org.springframework.boot.SpringApplication.refresh(SpringApplication.java:752) ~[spring-boot-3.5.3.jar:3.5.3]
	at org.springframework.boot.SpringApplication.refreshContext(SpringApplication.java:439) ~[spring-boot-3.5.3.jar:3.5.3]
	at org.springframework.boot.SpringApplication.run(SpringApplication.java:318) ~[spring-boot-3.5.3.jar:3.5.3]
	at org.springframework.boot.test.context.SpringBootContextLoader.lambda$loadContext$3(SpringBootContextLoader.java:144) ~[spring-boot-test-3.5.3.jar:3.5.3]
	at org.springframework.util.function.ThrowingSupplier.get(ThrowingSupplier.java:58) ~[spring-core-6.2.8.jar:6.2.8]
	at org.springframework.util.function.ThrowingSupplier.get(ThrowingSupplier.java:46) ~[spring-core-6.2.8.jar:6.2.8]
	at org.springframework.boot.SpringApplication.withHook(SpringApplication.java:1461) ~[spring-boot-3.5.3.jar:3.5.3]
	at org.springframework.boot.test.context.SpringBootContextLoader$ContextLoaderHook.run(SpringBootContextLoader.java:563) ~[spring-boot-test-3.5.3.jar:3.5.3]
	at org.springframework.boot.test.context.SpringBootContextLoader.loadContext(SpringBootContextLoader.java:144) ~[spring-boot-test-3.5.3.jar:3.5.3]
	at org.springframework.boot.test.context.SpringBootContextLoader.loadContext(SpringBootContextLoader.java:110) ~[spring-boot-test-3.5.3.jar:3.5.3]
	at org.springframework.test.context.cache.DefaultCacheAwareContextLoaderDelegate.loadContextInternal(DefaultCacheAwareContextLoaderDelegate.java:225) ~[spring-test-6.2.8.jar:6.2.8]
	at org.springframework.test.context.cache.DefaultCacheAwareContextLoaderDelegate.loadContext(DefaultCacheAwareContextLoaderDelegate.java:152) ~[spring-test-6.2.8.jar:6.2.8]
	... 79 common frames omitted
Caused by: org.springframework.dao.InvalidDataAccessResourceUsageException: could not execute statement [ERROR: column "role" is of type user_role but expression is of type character varying
  Hint: You will need to rewrite or cast the expression.
  Position: 203] [update users set address=?,created_at=?,date_of_birth=?,email=?,email_verified=?,failed_login_attempts=?,first_name=?,is_active=?,last_login_at=?,last_name=?,password_hash=?,phone=?,role=?,ssn_hash=?,updated_at=?,username=? where user_id=?]; SQL [update users set address=?,created_at=?,date_of_birth=?,email=?,email_verified=?,failed_login_attempts=?,first_name=?,is_active=?,last_login_at=?,last_name=?,password_hash=?,phone=?,role=?,ssn_hash=?,updated_at=?,username=? where user_id=?]
	at org.springframework.orm.jpa.vendor.HibernateJpaDialect.convertHibernateAccessException(HibernateJpaDialect.java:281) ~[spring-orm-6.2.8.jar:6.2.8]
	at org.springframework.orm.jpa.vendor.HibernateJpaDialect.convertHibernateAccessException(HibernateJpaDialect.java:256) ~[spring-orm-6.2.8.jar:6.2.8]
	at org.springframework.orm.jpa.vendor.HibernateJpaDialect.translateExceptionIfPossible(HibernateJpaDialect.java:241) ~[spring-orm-6.2.8.jar:6.2.8]
	at org.springframework.orm.jpa.JpaTransactionManager.doCommit(JpaTransactionManager.java:566) ~[spring-orm-6.2.8.jar:6.2.8]
	at org.springframework.transaction.support.AbstractPlatformTransactionManager.processCommit(AbstractPlatformTransactionManager.java:795) ~[spring-tx-6.2.8.jar:6.2.8]
	at org.springframework.transaction.support.AbstractPlatformTransactionManager.commit(AbstractPlatformTransactionManager.java:758) ~[spring-tx-6.2.8.jar:6.2.8]
	at org.springframework.transaction.interceptor.TransactionAspectSupport.commitTransactionAfterReturning(TransactionAspectSupport.java:698) ~[spring-tx-6.2.8.jar:6.2.8]
	at org.springframework.transaction.interceptor.TransactionAspectSupport.invokeWithinTransaction(TransactionAspectSupport.java:416) ~[spring-tx-6.2.8.jar:6.2.8]
	at org.springframework.transaction.interceptor.TransactionInterceptor.invoke(TransactionInterceptor.java:119) ~[spring-tx-6.2.8.jar:6.2.8]
	at org.springframework.aop.framework.ReflectiveMethodInvocation.proceed(ReflectiveMethodInvocation.java:184) ~[spring-aop-6.2.8.jar:6.2.8]
	at org.springframework.dao.support.PersistenceExceptionTranslationInterceptor.invoke(PersistenceExceptionTranslationInterceptor.java:138) ~[spring-tx-6.2.8.jar:6.2.8]
	at org.springframework.aop.framework.ReflectiveMethodInvocation.proceed(ReflectiveMethodInvocation.java:184) ~[spring-aop-6.2.8.jar:6.2.8]
	at org.springframework.data.jpa.repository.support.CrudMethodMetadataPostProcessor$CrudMethodMetadataPopulatingMethodInterceptor.invoke(CrudMethodMetadataPostProcessor.java:165) ~[spring-data-jpa-3.5.1.jar:3.5.1]
	at org.springframework.aop.framework.ReflectiveMethodInvocation.proceed(ReflectiveMethodInvocation.java:184) ~[spring-aop-6.2.8.jar:6.2.8]
	at org.springframework.aop.framework.JdkDynamicAopProxy.invoke(JdkDynamicAopProxy.java:223) ~[spring-aop-6.2.8.jar:6.2.8]
	at jdk.proxy2/jdk.proxy2.$Proxy140.save(Unknown Source) ~[na:na]
	at com.bank.demo.config.PasswordMigrationService.migratePasswords(PasswordMigrationService.java:30) ~[classes/:na]
	at java.base/jdk.internal.reflect.NativeMethodAccessorImpl.invoke0(Native Method) ~[na:na]
	at java.base/jdk.internal.reflect.NativeMethodAccessorImpl.invoke(NativeMethodAccessorImpl.java:77) ~[na:na]
	at java.base/jdk.internal.reflect.DelegatingMethodAccessorImpl.invoke(DelegatingMethodAccessorImpl.java:43) ~[na:na]
	at java.base/java.lang.reflect.Method.invoke(Method.java:569) ~[na:na]
	at org.springframework.beans.factory.annotation.InitDestroyAnnotationBeanPostProcessor$LifecycleMethod.invoke(InitDestroyAnnotationBeanPostProcessor.java:457) ~[spring-beans-6.2.8.jar:6.2.8]
	at org.springframework.beans.factory.annotation.InitDestroyAnnotationBeanPostProcessor$LifecycleMetadata.invokeInitMethods(InitDestroyAnnotationBeanPostProcessor.java:401) ~[spring-beans-6.2.8.jar:6.2.8]
	at org.springframework.beans.factory.annotation.InitDestroyAnnotationBeanPostProcessor.postProcessBeforeInitialization(InitDestroyAnnotationBeanPostProcessor.java:219) ~[spring-beans-6.2.8.jar:6.2.8]
	... 104 common frames omitted
Caused by: org.hibernate.exception.SQLGrammarException: could not execute statement [ERROR: column "role" is of type user_role but expression is of type character varying
  Hint: You will need to rewrite or cast the expression.
  Position: 203] [update users set address=?,created_at=?,date_of_birth=?,email=?,email_verified=?,failed_login_attempts=?,first_name=?,is_active=?,last_login_at=?,last_name=?,password_hash=?,phone=?,role=?,ssn_hash=?,updated_at=?,username=? where user_id=?]
	at org.hibernate.exception.internal.SQLStateConversionDelegate.convert(SQLStateConversionDelegate.java:91) ~[hibernate-core-6.6.18.Final.jar:6.6.18.Final]
	at org.hibernate.exception.internal.StandardSQLExceptionConverter.convert(StandardSQLExceptionConverter.java:58) ~[hibernate-core-6.6.18.Final.jar:6.6.18.Final]
	at org.hibernate.engine.jdbc.spi.SqlExceptionHelper.convert(SqlExceptionHelper.java:108) ~[hibernate-core-6.6.18.Final.jar:6.6.18.Final]
	at org.hibernate.engine.jdbc.internal.ResultSetReturnImpl.executeUpdate(ResultSetReturnImpl.java:197) ~[hibernate-core-6.6.18.Final.jar:6.6.18.Final]
	at org.hibernate.engine.jdbc.mutation.internal.AbstractMutationExecutor.performNonBatchedMutation(AbstractMutationExecutor.java:134) ~[hibernate-core-6.6.18.Final.jar:6.6.18.Final]
	at org.hibernate.engine.jdbc.mutation.internal.MutationExecutorSingleNonBatched.performNonBatchedOperations(MutationExecutorSingleNonBatched.java:55) ~[hibernate-core-6.6.18.Final.jar:6.6.18.Final]
	at org.hibernate.engine.jdbc.mutation.internal.AbstractMutationExecutor.execute(AbstractMutationExecutor.java:55) ~[hibernate-core-6.6.18.Final.jar:6.6.18.Final]
	at org.hibernate.persister.entity.mutation.UpdateCoordinatorStandard.doStaticUpdate(UpdateCoordinatorStandard.java:781) ~[hibernate-core-6.6.18.Final.jar:6.6.18.Final]
	at org.hibernate.persister.entity.mutation.UpdateCoordinatorStandard.performUpdate(UpdateCoordinatorStandard.java:328) ~[hibernate-core-6.6.18.Final.jar:6.6.18.Final]
	at org.hibernate.persister.entity.mutation.UpdateCoordinatorStandard.update(UpdateCoordinatorStandard.java:245) ~[hibernate-core-6.6.18.Final.jar:6.6.18.Final]
	at org.hibernate.action.internal.EntityUpdateAction.execute(EntityUpdateAction.java:169) ~[hibernate-core-6.6.18.Final.jar:6.6.18.Final]
	at org.hibernate.engine.spi.ActionQueue.executeActions(ActionQueue.java:644) ~[hibernate-core-6.6.18.Final.jar:6.6.18.Final]
	at org.hibernate.engine.spi.ActionQueue.executeActions(ActionQueue.java:511) ~[hibernate-core-6.6.18.Final.jar:6.6.18.Final]
	at org.hibernate.event.internal.AbstractFlushingEventListener.performExecutions(AbstractFlushingEventListener.java:414) ~[hibernate-core-6.6.18.Final.jar:6.6.18.Final]
	at org.hibernate.event.internal.DefaultFlushEventListener.onFlush(DefaultFlushEventListener.java:41) ~[hibernate-core-6.6.18.Final.jar:6.6.18.Final]
	at org.hibernate.event.service.internal.EventListenerGroupImpl.fireEventOnEachListener(EventListenerGroupImpl.java:127) ~[hibernate-core-6.6.18.Final.jar:6.6.18.Final]
	at org.hibernate.internal.SessionImpl.doFlush(SessionImpl.java:1429) ~[hibernate-core-6.6.18.Final.jar:6.6.18.Final]
	at org.hibernate.internal.SessionImpl.managedFlush(SessionImpl.java:491) ~[hibernate-core-6.6.18.Final.jar:6.6.18.Final]
	at org.hibernate.internal.SessionImpl.flushBeforeTransactionCompletion(SessionImpl.java:2354) ~[hibernate-core-6.6.18.Final.jar:6.6.18.Final]
	at org.hibernate.internal.SessionImpl.beforeTransactionCompletion(SessionImpl.java:1978) ~[hibernate-core-6.6.18.Final.jar:6.6.18.Final]
	at org.hibernate.engine.jdbc.internal.JdbcCoordinatorImpl.beforeTransactionCompletion(JdbcCoordinatorImpl.java:439) ~[hibernate-core-6.6.18.Final.jar:6.6.18.Final]
	at org.hibernate.resource.transaction.backend.jdbc.internal.JdbcResourceLocalTransactionCoordinatorImpl.beforeCompletionCallback(JdbcResourceLocalTransactionCoordinatorImpl.java:169) ~[hibernate-core-6.6.18.Final.jar:6.6.18.Final]
	at org.hibernate.resource.transaction.backend.jdbc.internal.JdbcResourceLocalTransactionCoordinatorImpl$TransactionDriverControlImpl.commit(JdbcResourceLocalTransactionCoordinatorImpl.java:267) ~[hibernate-core-6.6.18.Final.jar:6.6.18.Final]
	at org.hibernate.engine.transaction.internal.TransactionImpl.commit(TransactionImpl.java:101) ~[hibernate-core-6.6.18.Final.jar:6.6.18.Final]
	at org.springframework.orm.jpa.JpaTransactionManager.doCommit(JpaTransactionManager.java:562) ~[spring-orm-6.2.8.jar:6.2.8]
	... 124 common frames omitted
Caused by: org.postgresql.util.PSQLException: ERROR: column "role" is of type user_role but expression is of type character varying
  Hint: You will need to rewrite or cast the expression.
  Position: 203
	at org.postgresql.core.v3.QueryExecutorImpl.receiveErrorResponse(QueryExecutorImpl.java:2734) ~[postgresql-42.7.7.jar:42.7.7]
	at org.postgresql.core.v3.QueryExecutorImpl.processResults(QueryExecutorImpl.java:2421) ~[postgresql-42.7.7.jar:42.7.7]
	at org.postgresql.core.v3.QueryExecutorImpl.execute(QueryExecutorImpl.java:372) ~[postgresql-42.7.7.jar:42.7.7]
	at org.postgresql.jdbc.PgStatement.executeInternal(PgStatement.java:518) ~[postgresql-42.7.7.jar:42.7.7]
	at org.postgresql.jdbc.PgStatement.execute(PgStatement.java:435) ~[postgresql-42.7.7.jar:42.7.7]
	at org.postgresql.jdbc.PgPreparedStatement.executeWithFlags(PgPreparedStatement.java:196) ~[postgresql-42.7.7.jar:42.7.7]
	at org.postgresql.jdbc.PgPreparedStatement.executeUpdate(PgPreparedStatement.java:157) ~[postgresql-42.7.7.jar:42.7.7]
	at com.zaxxer.hikari.pool.ProxyPreparedStatement.executeUpdate(ProxyPreparedStatement.java:61) ~[HikariCP-6.3.0.jar:na]
	at com.zaxxer.hikari.pool.HikariProxyPreparedStatement.executeUpdate(HikariProxyPreparedStatement.java) ~[HikariCP-6.3.0.jar:na]
	at org.hibernate.engine.jdbc.internal.ResultSetReturnImpl.executeUpdate(ResultSetReturnImpl.java:194) ~[hibernate-core-6.6.18.Final.jar:6.6.18.Final]
	... 145 common frames omitted

[ERROR] Tests run: 1, Failures: 0, Errors: 1, Skipped: 0, Time elapsed: 3.333 s <<< FAILURE! -- in com.bank.demo.BankingApiApplicationTests
[ERROR] com.bank.demo.BankingApiApplicationTests.contextLoads -- Time elapsed: 0.008 s <<< ERROR!
java.lang.IllegalStateException: Failed to load ApplicationContext for [WebMergedContextConfiguration@45a9f3d4 testClass = com.bank.demo.BankingApiApplicationTests, locations = [], classes = [com.bank.demo.BankingApiApplication], contextInitializerClasses = [], activeProfiles = [], propertySourceDescriptors = [], propertySourceProperties = ["org.springframework.boot.test.context.SpringBootTestContextBootstrapper=true"], contextCustomizers = [org.springframework.boot.test.context.filter.ExcludeFilterContextCustomizer@792b749c, org.springframework.boot.test.json.DuplicateJsonObjectContextCustomizerFactory$DuplicateJsonObjectContextCustomizer@305ffe9e, org.springframework.boot.test.mock.mockito.MockitoContextCustomizer@0, org.springframework.boot.test.web.client.TestRestTemplateContextCustomizer@5a59ca5e, org.springframework.boot.test.web.reactor.netty.DisableReactorResourceFactoryGlobalResourcesContextCustomizerFactory$DisableReactorResourceFactoryGlobalResourcesContextCustomizerCustomizer@eadd4fb, org.springframework.boot.test.autoconfigure.OnFailureConditionReportContextCustomizerFactory$OnFailureConditionReportContextCustomizer@43f02ef2, org.springframework.boot.test.autoconfigure.actuate.observability.ObservabilityContextCustomizerFactory$DisableObservabilityContextCustomizer@1f, org.springframework.boot.test.autoconfigure.properties.PropertyMappingContextCustomizer@0, org.springframework.boot.test.autoconfigure.web.servlet.WebDriverContextCustomizer@c05fddc, org.springframework.test.context.support.DynamicPropertiesContextCustomizer@0, org.springframework.boot.test.context.SpringBootTestAnnotation@7391d966], resourceBasePath = "src/main/webapp", contextLoader = org.springframework.boot.test.context.SpringBootContextLoader, parent = null]
	at org.springframework.test.context.cache.DefaultCacheAwareContextLoaderDelegate.loadContext(DefaultCacheAwareContextLoaderDelegate.java:180)
	at org.springframework.test.context.support.DefaultTestContext.getApplicationContext(DefaultTestContext.java:130)
	at org.springframework.test.context.web.ServletTestExecutionListener.setUpRequestContextIfNecessary(ServletTestExecutionListener.java:200)
	at org.springframework.test.context.web.ServletTestExecutionListener.prepareTestInstance(ServletTestExecutionListener.java:139)
	at org.springframework.test.context.TestContextManager.prepareTestInstance(TestContextManager.java:260)
	at org.springframework.test.context.junit.jupiter.SpringExtension.postProcessTestInstance(SpringExtension.java:159)
	at java.base/java.util.stream.ForEachOps$ForEachOp$OfRef.accept(ForEachOps.java:183)
	at java.base/java.util.stream.ReferencePipeline$3$1.accept(ReferencePipeline.java:197)
	at java.base/java.util.stream.ReferencePipeline$2$1.accept(ReferencePipeline.java:179)
	at java.base/java.util.stream.ReferencePipeline$3$1.accept(ReferencePipeline.java:197)
	at java.base/java.util.ArrayList$ArrayListSpliterator.forEachRemaining(ArrayList.java:1625)
	at java.base/java.util.stream.AbstractPipeline.copyInto(AbstractPipeline.java:509)
	at java.base/java.util.stream.AbstractPipeline.wrapAndCopyInto(AbstractPipeline.java:499)
	at java.base/java.util.stream.ForEachOps$ForEachOp.evaluateSequential(ForEachOps.java:150)
	at java.base/java.util.stream.ForEachOps$ForEachOp$OfRef.evaluateSequential(ForEachOps.java:173)
	at java.base/java.util.stream.AbstractPipeline.evaluate(AbstractPipeline.java:234)
	at java.base/java.util.stream.ReferencePipeline.forEach(ReferencePipeline.java:596)
	at java.base/java.util.Optional.orElseGet(Optional.java:364)
	at java.base/java.util.ArrayList.forEach(ArrayList.java:1511)
	at java.base/java.util.ArrayList.forEach(ArrayList.java:1511)
Caused by: org.springframework.beans.factory.BeanCreationException: Error creating bean with name 'passwordMigrationService': Invocation of init method failed
	at org.springframework.beans.factory.annotation.InitDestroyAnnotationBeanPostProcessor.postProcessBeforeInitialization(InitDestroyAnnotationBeanPostProcessor.java:222)
	at org.springframework.beans.factory.support.AbstractAutowireCapableBeanFactory.applyBeanPostProcessorsBeforeInitialization(AbstractAutowireCapableBeanFactory.java:429)
	at org.springframework.beans.factory.support.AbstractAutowireCapableBeanFactory.initializeBean(AbstractAutowireCapableBeanFactory.java:1818)
	at org.springframework.beans.factory.support.AbstractAutowireCapableBeanFactory.doCreateBean(AbstractAutowireCapableBeanFactory.java:607)
	at org.springframework.beans.factory.support.AbstractAutowireCapableBeanFactory.createBean(AbstractAutowireCapableBeanFactory.java:529)
	at org.springframework.beans.factory.support.AbstractBeanFactory.lambda$doGetBean$0(AbstractBeanFactory.java:339)
	at org.springframework.beans.factory.support.DefaultSingletonBeanRegistry.getSingleton(DefaultSingletonBeanRegistry.java:373)
	at org.springframework.beans.factory.support.AbstractBeanFactory.doGetBean(AbstractBeanFactory.java:337)
	at org.springframework.beans.factory.support.AbstractBeanFactory.getBean(AbstractBeanFactory.java:202)
	at org.springframework.beans.factory.support.DefaultListableBeanFactory.instantiateSingleton(DefaultListableBeanFactory.java:1222)
	at org.springframework.beans.factory.support.DefaultListableBeanFactory.preInstantiateSingleton(DefaultListableBeanFactory.java:1188)
	at org.springframework.beans.factory.support.DefaultListableBeanFactory.preInstantiateSingletons(DefaultListableBeanFactory.java:1123)
	at org.springframework.context.support.AbstractApplicationContext.finishBeanFactoryInitialization(AbstractApplicationContext.java:987)
	at org.springframework.context.support.AbstractApplicationContext.refresh(AbstractApplicationContext.java:627)
	at org.springframework.boot.SpringApplication.refresh(SpringApplication.java:752)
	at org.springframework.boot.SpringApplication.refreshContext(SpringApplication.java:439)
	at org.springframework.boot.SpringApplication.run(SpringApplication.java:318)
	at org.springframework.boot.test.context.SpringBootContextLoader.lambda$loadContext$3(SpringBootContextLoader.java:144)
	at org.springframework.util.function.ThrowingSupplier.get(ThrowingSupplier.java:58)
	at org.springframework.util.function.ThrowingSupplier.get(ThrowingSupplier.java:46)
	at org.springframework.boot.SpringApplication.withHook(SpringApplication.java:1461)
	at org.springframework.boot.test.context.SpringBootContextLoader$ContextLoaderHook.run(SpringBootContextLoader.java:563)
	at org.springframework.boot.test.context.SpringBootContextLoader.loadContext(SpringBootContextLoader.java:144)
	at org.springframework.boot.test.context.SpringBootContextLoader.loadContext(SpringBootContextLoader.java:110)
	at org.springframework.test.context.cache.DefaultCacheAwareContextLoaderDelegate.loadContextInternal(DefaultCacheAwareContextLoaderDelegate.java:225)
	at org.springframework.test.context.cache.DefaultCacheAwareContextLoaderDelegate.loadContext(DefaultCacheAwareContextLoaderDelegate.java:152)
	... 19 more
Caused by: org.springframework.dao.InvalidDataAccessResourceUsageException: could not execute statement [ERROR: column "role" is of type user_role but expression is of type character varying
  Hint: You will need to rewrite or cast the expression.
  Position: 203] [update users set address=?,created_at=?,date_of_birth=?,email=?,email_verified=?,failed_login_attempts=?,first_name=?,is_active=?,last_login_at=?,last_name=?,password_hash=?,phone=?,role=?,ssn_hash=?,updated_at=?,username=? where user_id=?]; SQL [update users set address=?,created_at=?,date_of_birth=?,email=?,email_verified=?,failed_login_attempts=?,first_name=?,is_active=?,last_login_at=?,last_name=?,password_hash=?,phone=?,role=?,ssn_hash=?,updated_at=?,username=? where user_id=?]
	at org.springframework.orm.jpa.vendor.HibernateJpaDialect.convertHibernateAccessException(HibernateJpaDialect.java:281)
	at org.springframework.orm.jpa.vendor.HibernateJpaDialect.convertHibernateAccessException(HibernateJpaDialect.java:256)
	at org.springframework.orm.jpa.vendor.HibernateJpaDialect.translateExceptionIfPossible(HibernateJpaDialect.java:241)
	at org.springframework.orm.jpa.JpaTransactionManager.doCommit(JpaTransactionManager.java:566)
	at org.springframework.transaction.support.AbstractPlatformTransactionManager.processCommit(AbstractPlatformTransactionManager.java:795)
	at org.springframework.transaction.support.AbstractPlatformTransactionManager.commit(AbstractPlatformTransactionManager.java:758)
	at org.springframework.transaction.interceptor.TransactionAspectSupport.commitTransactionAfterReturning(TransactionAspectSupport.java:698)
	at org.springframework.transaction.interceptor.TransactionAspectSupport.invokeWithinTransaction(TransactionAspectSupport.java:416)
	at org.springframework.transaction.interceptor.TransactionInterceptor.invoke(TransactionInterceptor.java:119)
	at org.springframework.aop.framework.ReflectiveMethodInvocation.proceed(ReflectiveMethodInvocation.java:184)
	at org.springframework.dao.support.PersistenceExceptionTranslationInterceptor.invoke(PersistenceExceptionTranslationInterceptor.java:138)
	at org.springframework.aop.framework.ReflectiveMethodInvocation.proceed(ReflectiveMethodInvocation.java:184)
	at org.springframework.data.jpa.repository.support.CrudMethodMetadataPostProcessor$CrudMethodMetadataPopulatingMethodInterceptor.invoke(CrudMethodMetadataPostProcessor.java:165)
	at org.springframework.aop.framework.ReflectiveMethodInvocation.proceed(ReflectiveMethodInvocation.java:184)
	at org.springframework.aop.framework.JdkDynamicAopProxy.invoke(JdkDynamicAopProxy.java:223)
	at jdk.proxy2/jdk.proxy2.$Proxy140.save(Unknown Source)
	at com.bank.demo.config.PasswordMigrationService.migratePasswords(PasswordMigrationService.java:30)
	at java.base/java.lang.reflect.Method.invoke(Method.java:569)
	at org.springframework.beans.factory.annotation.InitDestroyAnnotationBeanPostProcessor$LifecycleMethod.invoke(InitDestroyAnnotationBeanPostProcessor.java:457)
	at org.springframework.beans.factory.annotation.InitDestroyAnnotationBeanPostProcessor$LifecycleMetadata.invokeInitMethods(InitDestroyAnnotationBeanPostProcessor.java:401)
	at org.springframework.beans.factory.annotation.InitDestroyAnnotationBeanPostProcessor.postProcessBeforeInitialization(InitDestroyAnnotationBeanPostProcessor.java:219)
	... 44 more
Caused by: org.hibernate.exception.SQLGrammarException: could not execute statement [ERROR: column "role" is of type user_role but expression is of type character varying
  Hint: You will need to rewrite or cast the expression.
  Position: 203] [update users set address=?,created_at=?,date_of_birth=?,email=?,email_verified=?,failed_login_attempts=?,first_name=?,is_active=?,last_login_at=?,last_name=?,password_hash=?,phone=?,role=?,ssn_hash=?,updated_at=?,username=? where user_id=?]
	at org.hibernate.exception.internal.SQLStateConversionDelegate.convert(SQLStateConversionDelegate.java:91)
	at org.hibernate.exception.internal.StandardSQLExceptionConverter.convert(StandardSQLExceptionConverter.java:58)
	at org.hibernate.engine.jdbc.spi.SqlExceptionHelper.convert(SqlExceptionHelper.java:108)
	at org.hibernate.engine.jdbc.internal.ResultSetReturnImpl.executeUpdate(ResultSetReturnImpl.java:197)
	at org.hibernate.engine.jdbc.mutation.internal.AbstractMutationExecutor.performNonBatchedMutation(AbstractMutationExecutor.java:134)
	at org.hibernate.engine.jdbc.mutation.internal.MutationExecutorSingleNonBatched.performNonBatchedOperations(MutationExecutorSingleNonBatched.java:55)
	at org.hibernate.engine.jdbc.mutation.internal.AbstractMutationExecutor.execute(AbstractMutationExecutor.java:55)
	at org.hibernate.persister.entity.mutation.UpdateCoordinatorStandard.doStaticUpdate(UpdateCoordinatorStandard.java:781)
	at org.hibernate.persister.entity.mutation.UpdateCoordinatorStandard.performUpdate(UpdateCoordinatorStandard.java:328)
	at org.hibernate.persister.entity.mutation.UpdateCoordinatorStandard.update(UpdateCoordinatorStandard.java:245)
	at org.hibernate.action.internal.EntityUpdateAction.execute(EntityUpdateAction.java:169)
	at org.hibernate.engine.spi.ActionQueue.executeActions(ActionQueue.java:644)
	at org.hibernate.engine.spi.ActionQueue.executeActions(ActionQueue.java:511)
	at org.hibernate.event.internal.AbstractFlushingEventListener.performExecutions(AbstractFlushingEventListener.java:414)
	at org.hibernate.event.internal.DefaultFlushEventListener.onFlush(DefaultFlushEventListener.java:41)
	at org.hibernate.event.service.internal.EventListenerGroupImpl.fireEventOnEachListener(EventListenerGroupImpl.java:127)
	at org.hibernate.internal.SessionImpl.doFlush(SessionImpl.java:1429)
	at org.hibernate.internal.SessionImpl.managedFlush(SessionImpl.java:491)
	at org.hibernate.internal.SessionImpl.flushBeforeTransactionCompletion(SessionImpl.java:2354)
	at org.hibernate.internal.SessionImpl.beforeTransactionCompletion(SessionImpl.java:1978)
	at org.hibernate.engine.jdbc.internal.JdbcCoordinatorImpl.beforeTransactionCompletion(JdbcCoordinatorImpl.java:439)
	at org.hibernate.resource.transaction.backend.jdbc.internal.JdbcResourceLocalTransactionCoordinatorImpl.beforeCompletionCallback(JdbcResourceLocalTransactionCoordinatorImpl.java:169)
	at org.hibernate.resource.transaction.backend.jdbc.internal.JdbcResourceLocalTransactionCoordinatorImpl$TransactionDriverControlImpl.commit(JdbcResourceLocalTransactionCoordinatorImpl.java:267)
	at org.hibernate.engine.transaction.internal.TransactionImpl.commit(TransactionImpl.java:101)
	at org.springframework.orm.jpa.JpaTransactionManager.doCommit(JpaTransactionManager.java:562)
	... 61 more
Caused by: org.postgresql.util.PSQLException: ERROR: column "role" is of type user_role but expression is of type character varying
  Hint: You will need to rewrite or cast the expression.
  Position: 203
	at org.postgresql.core.v3.QueryExecutorImpl.receiveErrorResponse(QueryExecutorImpl.java:2734)
	at org.postgresql.core.v3.QueryExecutorImpl.processResults(QueryExecutorImpl.java:2421)
	at org.postgresql.core.v3.QueryExecutorImpl.execute(QueryExecutorImpl.java:372)
	at org.postgresql.jdbc.PgStatement.executeInternal(PgStatement.java:518)
	at org.postgresql.jdbc.PgStatement.execute(PgStatement.java:435)
	at org.postgresql.jdbc.PgPreparedStatement.executeWithFlags(PgPreparedStatement.java:196)
	at org.postgresql.jdbc.PgPreparedStatement.executeUpdate(PgPreparedStatement.java:157)
	at com.zaxxer.hikari.pool.ProxyPreparedStatement.executeUpdate(ProxyPreparedStatement.java:61)
	at com.zaxxer.hikari.pool.HikariProxyPreparedStatement.executeUpdate(HikariProxyPreparedStatement.java)
	at org.hibernate.engine.jdbc.internal.ResultSetReturnImpl.executeUpdate(ResultSetReturnImpl.java:194)
	... 82 more

[INFO] 
[INFO] Results:
[INFO] 
[ERROR] Errors: 
[ERROR]   BankingApiApplicationTests.contextLoads  IllegalState Failed to load ApplicationContext for [WebMergedContextConfiguration@45a9f3d4 testClass = com.bank.demo.BankingApiApplicationTests, locations = [], classes = [com.bank.demo.BankingApiApplication], contextInitializerClasses = [], activeProfiles = [], propertySourceDescriptors = [], propertySourceProperties = ["org.springframework.boot.test.context.SpringBootTestContextBootstrapper=true"], contextCustomizers = [org.springframework.boot.test.context.filter.ExcludeFilterContextCustomizer@792b749c, org.springframework.boot.test.json.DuplicateJsonObjectContextCustomizerFactory$DuplicateJsonObjectContextCustomizer@305ffe9e, org.springframework.boot.test.mock.mockito.MockitoContextCustomizer@0, org.springframework.boot.test.web.client.TestRestTemplateContextCustomizer@5a59ca5e, org.springframework.boot.test.web.reactor.netty.DisableReactorResourceFactoryGlobalResourcesContextCustomizerFactory$DisableReactorResourceFactoryGlobalResourcesContextCustomizerCustomizer@eadd4fb, org.springframework.boot.test.autoconfigure.OnFailureConditionReportContextCustomizerFactory$OnFailureConditionReportContextCustomizer@43f02ef2, org.springframework.boot.test.autoconfigure.actuate.observability.ObservabilityContextCustomizerFactory$DisableObservabilityContextCustomizer@1f, org.springframework.boot.test.autoconfigure.properties.PropertyMappingContextCustomizer@0, org.springframework.boot.test.autoconfigure.web.servlet.WebDriverContextCustomizer@c05fddc, org.springframework.test.context.support.DynamicPropertiesContextCustomizer@0, org.springframework.boot.test.context.SpringBootTestAnnotation@7391d966], resourceBasePath = "src/main/webapp", contextLoader = org.springframework.boot.test.context.SpringBootContextLoader, parent = null]
[INFO] 
[ERROR] Tests run: 1, Failures: 0, Errors: 1, Skipped: 0
[INFO] 
[INFO] ------------------------------------------------------------------------
[INFO] BUILD FAILURE
[INFO] ------------------------------------------------------------------------
[INFO] Total time:  6.535 s
[INFO] Finished at: 2025-08-08T01:31:36-04:00
[INFO] ------------------------------------------------------------------------
[ERROR] Failed to execute goal org.apache.maven.plugins:maven-surefire-plugin:3.5.3:test (default-test) on project demo: 
[ERROR] 
[ERROR] See /home/cactus1549/Banking_webApp/banking-api/demo/target/surefire-reports for the individual test results.
[ERROR] See dump files (if any exist) [date].dump, [date]-jvmRun[N].dump and [date].dumpstream.
[ERROR] -> [Help 1]
[ERROR] 
[ERROR] To see the full stack trace of the errors, re-run Maven with the -e switch.
[ERROR] Re-run Maven using the -X switch to enable full debug logging.
[ERROR] 
[ERROR] For more information about the errors and possible solutions, please read the following articles:
[ERROR] [Help 1] http://cwiki.apache.org/confluence/display/MAVEN/MojoFailureException
